{
  "schema_version": "0.1.0",
  "tenant_id": "synthetic_demo",
  "source": "traccar_forwarder",
  "event_identity": {
    "basis": "vendor_event_id",
    "value": "evt_01JEXAMPLE"
  },
  "asset_ref": "ast_9a3f0011",
  "device_ref": "dev_c8240022",
  "received_at": "2026-08-05T09:20:04.000Z",
  "quality": {
    "raw_sha256": "aaaaaaaaaaaaaaaaaaaaaaaaaaaaaaaaaaaaaaaaaaaaaaaaaaaaaaaaaaaaaaaa",
    "adapter_version": "traccar-1.0.0"
  },
  "device_time": null,
  "motion": {
    "ignition": "unknown",
    "motion_state": "unknown"
  },
  "power": {
    "external_state": "unknown",
    "external_v": null
  }
}